[
  {
    "lap": 1,
    "time": {
      "time": 90457,
      "formattedTime": "1:30.457"
    },
    "splits": [
      30842,
      29842,
      29772
    ],
    "formattedSplits": [
      "0:30.842",
      "0:29.842",
      "0:29.772"
    ],
    "type": "Regular",
    "valid": false,
    "boxLap": false,
    "clock": "21:02",
    "trackGripStatus": "OPTIMUM",
    "tyre": {
      "currentTyreSet": 1
    },
    "carInfo": {
      "fuel": 48.79
    }
  },
  {
    "lap": 2,
    "time": {
      "time": 89490,
      "formattedTime": "1:29.490"
    },
    "splits": [
      30287,
      29532,
      29670
    ],
    "type": "Regular",
    "valid": true,
    "boxLap": false,
    "clock": "21:04",
    "trackGripStatus": "OPTIMUM",
    "tyre": {
      "currentTyreSet": 1
    },
    "carInfo": {
      "fuel": 46.09
    }
  }
]