[
  {
    "lap": 1,
    "type": "Outlap",
    "valid": true,
    "time": {
      "time": 95000
    },
    "splits": [
      31000,
      32000,
      32000
    ],
    "tyre": {
      "currentTyreSet": 3
    },
    "carInfo": {
      "fuel": 60
    }
  },
  {
    "lap": 2,
    "type": "Regular",
    "valid": true,
    "time": {
      "time": 90000
    },
    "splits": [
      30000,
      30000,
      30000
    ],
    "tyre": {
      "currentTyreSet": 3
    },
    "carInfo": {
      "fuel": 57
    }
  },
  {
    "lap": 3,
    "type": "Regular",
    "valid": true,
    "time": {
      "time": 90500
    },
    "splits": [
      30200,
      30000,
      30300
    ],
    "tyre": {
      "currentTyreSet": 4
    },
    "carInfo": {
      "fuel": 54
    }
  },
  {
    "lap": 4,
    "type": "Regular",
    "valid": true,
    "time": {
      "time": 91000
    },
    "splits": [
      30500,
      30000,
      30500
    ],
    "tyre": {
      "currentTyreSet": 4
    },
    "carInfo": {
      "fuel": 51
    }
  },
  {
    "lap": 5,
    "type": "Inlap",
    "valid": true,
    "time": {
      "time": 100000
    },
    "splits": [
      31000,
      31000,
      38000
    ],
    "tyre": {
      "currentTyreSet": 4
    },
    "carInfo": {
      "fuel": 49
    }
  }
]